{
  "schemaVersion": "1.0.0",
  "documentVersion": "1.0.113",
  "id": "work-unit-durable-execution-supervisor",
  "artifactType": "specification",
  "projectId": "agent-factory",
  "lifecycle": {
    "phase": "specification",
    "status": "draft"
  },
  "createdAt": "2026-07-25T10:28:02+00:00",
  "updatedAt": "2026-07-30T19:17:24+00:00",
  "language": "ko",
  "theme": "default",
  "provenance": {
    "createdBy": "Human",
    "generatedBy": "Agent Factory specification manager",
    "sourceRefs": [
      {
        "artifactType": "intake",
        "id": "work-unit-durable-control-plane",
        "path": ".agent-factory/intakes/work-unit-durable-control-plane",
        "anchor": {
          "sectionId": "work-unit-basis",
          "itemId": "WORK-UNIT-BASIS-SPEC-001"
        }
      }
    ]
  },
  "relations": [
    {
      "type": "governed-by",
      "target": {
        "artifactType": "specification",
        "id": "project-core",
        "path": ".agent-factory/specifications/project-core"
      }
    }
  ],
  "documentClass": "architecture",
  "documentProfile": {
    "id": "system-architecture",
    "version": "1.0.0"
  }
}
